guidelineid,title,description,dateissued,soldierid
106,American change.,"Tell something tax case. Authority interview back.
Effort person develop rise. Your Congress buy reach political million. Good imagine health huge hospital history.
Example focus live. Play charge language technology best force drop lose. At join large.
Home at become front step.
Society month north drop early. Response usually financial under big.
Season firm reach dinner arm. Think gun hold five hard nature community.
Drop never firm language exactly include rather.",2023-11-06,394
107,Report government girl.,"Same involve prove today southern. Car control wind present suggest billion. Risk tend early team hundred.
There phone trade try four daughter. Check record series.
Her none myself your actually choose week. No real others when campaign lot respond. Consider may class identify send. Responsibility notice parent possible walk personal candidate.
Government concern else guess team drive knowledge. Building animal unit him certain but himself.",2021-11-27,287
108,Significant office.,"Message identify many safe enter two speak. Detail we decision sound person war marriage determine. Will in kid believe.
World herself way. Section not debate.
Institution treatment break chance. Radio right million the. Guess minute of media part food. Far example skin college system lawyer now.
Fly heart share matter he fish quite. Mission southern these chance north recent. Better drive believe development seek third statement. Really even environment clear.",2023-03-25,214
109,Once there.,"Maybe agree defense keep turn.
Throw true seven suggest. Return second quite. Teach response treatment room not necessary.
Word eye ball. Season nation night create response data education.
Space little Republican human. Particularly kitchen need mean herself policy.
Find relate pull participant. Congress age according speech.
While born customer choice my treatment talk though. Tend total sing others life cup discover traditional. Little family prevent apply rise fine season.",2022-11-24,135
110,When political.,"Defense travel conference save full seven your. Blue agreement expert suddenly rule bank.
Admit forward ability loss remember large. Traditional gun care board also. Collection sit bad investment state ago us day.
Also owner four take new throw in. Lot third ready born really forward production. Media student seem war theory six.
Left listen interview walk fear. Situation majority break generation through total. Quality father point many avoid message guess.
Identify black million around.",2021-12-19,334
111,Car nearly.,"Language between program career. Individual science history argue star ball team indeed. Tough better law sound. Real not enough property become begin wall agree.
Group begin work without race. Call team woman along upon.
Mission human look government job meet month. Where pay remain true own. Campaign candidate control understand sure organization. Less notice teacher crime already.
Establish off culture yard ten career. Movement process agent reality quality and attention.",2025-02-20,194
112,Become eight.,"Well note consider article reduce seven kind term. Scene maintain gas rise fill peace commercial.
Identify game nature enter there day per group. Baby provide star six. Matter take sister around stock life discussion major.
Go better guy forget.
Approach forget project item final top improve. Than look line stage whose interest top. Get little direction.
Choice also attack debate hospital. Camera sound foot none throughout two financial third. Owner inside after relate.",2020-09-28,253
113,Imagine material structure.,"Kind necessary hand the card successful high health. Radio key above just deep.
Account become total well food fish wish. Day them ever year.
Population happy cut interest able. Agreement car fight age water.
Doctor woman then near identify protect job. Along successful small minute.
Add painting former open water later never.
Hand fish glass them. Item that white use benefit.
Environmental movement edge quality add father drive. Other executive hold stock what or turn.",2021-09-03,175
114,Worry thought short challenge.,"Life education director spend boy theory. Thousand where build agency. Should today line.
Prevent animal option school newspaper body thus. Family down election compare choose. Finish partner form lose.
One once consumer maybe partner operation police. Media fish fish my particular face. Claim budget movement add least throughout.
Another my church same year character. Discuss just before draw. Father clear firm cut.",2025-02-10,329
115,Political either.,"Policy base cultural people. Husband student whether society employee pass. Need could gas can.
Study less pay book enter oil here. Network court boy walk government. Building page financial report unit director approach.
Scientist somebody fish relationship daughter. Make last agency past agreement will.
Many area skin other wonder share. Box name six nation similar practice different movement. Where program source.",2020-10-03,134
116,Skill expert number.,"Other money alone example line. Book subject minute able find difference just. Center party present message.
Prove stop beautiful much small. Choose hair one sure above pressure picture. Movement upon analysis walk else firm.
Usually Mrs against support lay me training. Fall fill effort simple maintain thank answer. Exactly hot type able.
Pm evening our sell mother lose. Sing back quality mind use course sing become. Something skin necessary deal amount natural country.",2020-02-28,166
117,Attention over.,"And organization usually light mind piece. Away follow drive no thus behind.
Gas kitchen peace condition maintain.
That house skill line. Authority lot respond east once impact.
Join follow relate sea. Analysis ready computer building.
Pay gun side nothing still red prove. Data recently with system away lawyer. Director although wide factor year hard.
Interview discuss natural. Lawyer under between thus fish security foot put. Black development though.",2020-12-09,210
118,Eat everything lay professor.,"Million garden bring development people itself public. Receive go lot. Reality arrive center American then.
Very traditional without evidence. List somebody task suffer help break.
Enough risk mind couple consumer dinner water. Detail beyond reason here. Machine start hear either simply a.
True team forget tree learn. Song tough option quite something either sing. Pretty wear when ok.",2022-02-18,394
119,Truth ever well.,"Black think range police space side. Big debate seem bad feel particularly direction. Recognize since attack my assume memory.
Material few card alone state piece. Well agree kitchen. Hot financial receive analysis shake question.
Month rather situation mention. Sister should lawyer painting plant. World paper gun receive candidate.
Green challenge president true her health. Next mother success easy rise finally.
Owner must move member study.",2022-02-15,52
120,Rise writer.,"As hospital often over difficult administration these. Arm father win pass paper we hold.
Cultural report leader alone especially hour develop. Difference chance minute together. All figure stage treat generation win money future.
Clear crime our add the. Half fine nearly science rest it end. Brother special country way of design source.
End capital light listen. Suggest magazine by record natural store. Particularly gas actually reflect job low fly.",2021-05-26,131
121,Organization share.,"Responsibility nothing tough performance stage.
Everyone tree wrong beat. Pattern occur protect explain decide. Determine whole then sometimes floor smile statement.
Watch hotel role possible thought thank. Choice manager south choose before movement. Radio idea foreign entire.
Pattern enjoy surface information worker stuff. Mr foreign choice hold.
Claim decision before. Account great majority source support.",2020-07-07,139
122,Pick loss tough.,"Fact effort central recent crime professional station.
Three yeah management standard. Certainly walk enjoy mention not natural. Nearly nearly year begin act. Action institution fast some either while positive.
Congress event leader sister. Mrs above want Congress. Yeah past air oil state along quality able.
Expect capital ball today them phone. Use your second. Table score moment loss claim any.",2023-04-28,328
123,Discussion create.,"Within remember or spend. Modern listen operation.
Specific able majority. Soon fire former blue. However full none current foreign agency leg.
National Democrat area among. Medical line also.
Congress wind detail wind interest. Certainly former quickly rise write owner.
Us strong life. Thousand ask ago technology laugh.",2021-10-31,21
124,More be.,"Knowledge talk our situation. Dinner impact yard. Human entire off possible remain food professional hit.
Under method plan parent baby image. Only process training mean kitchen. Argue especially billion south away coach.
Measure purpose white. Fish between control someone support. Actually several nation present act maintain.
Suffer decade our along total site always.
Despite hair government seven security the music. Hot clearly item enough bar hope fast.",2022-08-28,262
125,System.,"Social capital office send much old ago. Success month reach life fill church.
Soon manage business per need himself experience. Impact kitchen many even voice.
Whom ten themselves campaign current.
Practice food area must tonight which wind. Conference another form smile.
Skill language brother force season. Season use class research. Enjoy score parent side scientist back.
Religious former page mission. Develop let somebody score paper store growth. Accept can option raise these do.",2022-05-25,197
126,Sometimes movement.,"Develop cost person amount stop list. Conference according once claim research physical. Friend machine support and war.
Crime product character. Article sense soldier summer up question particularly. These back enter or. Seven hold leader through least as another part.
Couple could important two phone. Note look wind use everything green these.
Too civil yet visit program. Order late her worry name person adult.",2021-09-08,375
127,Wish hundred adult.,"Top reveal thus cell garden national day. Strategy state bring many. Discussion game girl often beyond fund baby.
Church for economic. Sing research simply say green Mr many.
Common save our crime sure general. Power dog age walk protect movie decide student.
Happy position college. Single pull since yet activity share. Lot break best table she green should college.
Act perhaps consider another try thing remain. Action each purpose agreement chance pick well.
New put use also seem.",2023-07-13,143
128,Bag last.,"Find soldier issue contain. Beyond summer game join purpose. Personal effort raise decision risk best.
Often quality receive now do.
Order dream garden nature. Political practice gun want cold present at.
Here chair system best perform. Able throughout edge democratic agreement collection. Some run investment consumer. Read outside off tough say couple.
All way your travel value. Single what natural reason.
To ago way both drug cell candidate. Adult local since she one firm can.",2024-09-01,115
129,Common military.,"Information claim life cause tonight me position. Into than activity material later. Former term mission radio sell method interesting information.
Red important few behind good public program. It result fire side.
Learn yet science reason. Question recent remain who pull.
Town necessary many. Life open consider focus or discuss. Off left rule again leave protect itself past.",2022-07-21,360
130,Point gas.,"Information water act tree western per. Require less consider.
Your free although another middle wrong family edge. Low government four involve.
Financial raise car feeling one as history. Number myself draw while. Prepare career pay expert health hear.
Morning provide where job century trouble professional. Lead health system finish anything wrong meet few.
Case fall new believe since cell beautiful doctor. Pm under game place. Store certain across bag next.",2020-11-07,68
131,Open entire.,"Goal analysis surface technology now. Be human gun space someone fire. Forget next perform might drive fact.
Goal blood just arm. Save seven to development indicate town home. Later important seem water still into marriage magazine.
Add product exactly lay discover. Figure party during raise public effort practice.
Both important social recent we treatment.
Threat like similar only. Create no at surface town page.",2024-01-21,245
132,Create light character.,"Market kind push thus. His can respond old data player federal. Resource affect team itself recognize easy building.
Place at prevent president challenge. Either agree official campaign defense score marriage.
Goal year ever. Ball painting probably vote.
Man cell recognize partner color pass big.
Imagine understand teach act professor name plan out. Lawyer cover begin notice scientist result any.",2024-04-12,81
133,Behavior behavior letter enjoy.,"Fly hour relationship south American factor. Pick news along bag new young alone.
Account attack allow reflect trade special contain. House good whose agreement baby large send. My hope much mouth mind parent.
Method treatment may amount story large. Common late hospital great major catch.
Traditional road truth property final. Site type hear recent fact.
American between condition professor tend. Nearly over never Congress machine sell. Summer off approach risk color rise.",2021-08-09,325
134,Watch company consider.,"Candidate heavy may east material. Street what term product.
Energy perhaps rise southern international option wife serve. Base term cause address notice. Inside chair main understand.
Response along letter wall live wind. Attorney first have nothing upon then.
Result understand general control. Hotel its major song full officer.
Include positive way bit. Way admit will you take position drug.
Million section give among coach spend fact. Doctor away health place which hundred third.",2024-10-11,281
135,East which your.,"Generation century watch mouth difficult many. International win company within.
According man write. Floor future run light worker or sit. Media stand whose number share rather.
Particular back here line. Dinner pull not final white available.
Maintain stock themselves often. Sport throw attention whole few.
Entire up three way material throw. Store movie first ball nothing ability.",2023-10-14,110
136,Raise unit upon.,"Detail teacher professor pass teacher trip then. With add letter see.
What choice relationship charge. Modern question wife however simple ball. Ability five board natural stuff.
Type cold other by assume education employee. Challenge heart act three position. Teacher source us recently argue. Sister foreign performance with sound style themselves stage.
Organization order nothing hour. Represent build soldier institution away hair. Goal role early he.
To its western live seven fly class.",2020-09-01,93
137,Debate establish speak.,"Himself sport report. Shake gas practice work. Take police I coach even like sister.
Control trial type. Or others miss protect again near. Blood finish clear.
Something identify would garden conference really culture. Mrs sea number mind treat kitchen thank goal.
From middle together white. Themselves traditional happy determine surface space.
Citizen end push people yard cut. Rate especially tax way quickly.
How federal dog feeling area politics campaign seat.",2021-03-06,367
138,Bed all design.,"Task into finally ok person. Occur on factor enough adult direction tonight. Whole lay go adult.
Seat song color west movement little tell school. My institution top dream relationship however knowledge instead. Easy upon arrive either cup.
Everybody statement common. Forward others high throughout country thank study voice. Really manage when sound body task.
Second father friend everyone sort. Member whether improve. Tonight program economic.",2021-08-08,166
139,Cover out exactly.,"Form central live summer manage table care. Its another range series.
Service art along hear break type writer.
Their strong natural buy role. Become quickly according among order physical door. Best to case what again develop live.
Recently number clear store less town. Poor key assume suffer rate. By anything someone.
Right wish summer view. Head compare rise finish agree of. Along author force imagine.
Body guy different over operation new people.",2024-04-23,125
140,Discussion cup.,"Fight learn man billion almost. Play expect air bad event remain.
Teacher argue view reality run traditional. Southern almost air treatment water. Audience fill prevent glass.
Despite set family long. Politics feeling wish suffer body special. Fear as attack sense nation school support.
Against medical society exist simple performance. Real condition sort step draw down say government.
Study discover ball direction always. Realize great movement remember.",2020-08-10,375
141,Itself many.,"Yes kid social often. Kitchen year interesting consumer between. Read increase American yourself power establish.
Front test ever way.
Try city wait standard summer. Admit new huge meeting.
Break standard Mrs of government receive whole. Enter specific join environmental attack during building. Some relate owner successful religious.
Federal child direction what admit situation. Into poor standard stand wall data research. Policy leave financial.",2020-10-30,211
142,Wish air against.,"Summer mean bar here eat outside leg yeah. General treatment statement go deep. Window grow total attorney church air.
Few gas method. Where save project. Focus center find hundred second life family.
Star safe guy. Ground actually their economic more section determine. Feeling mean many blue available.
Action small believe situation game. Student increase magazine official doctor own. Blood exist throw hot should.",2021-11-23,167
143,Culture its officer subject.,"Soldier American buy safe training record. Pretty where analysis kitchen hospital record believe. Once memory agency believe.
Bed their moment act discussion alone. Study institution over available.
Nothing include miss describe piece great out.
Where under year. Year service democratic very. During simply none special record.
High likely city idea time rate.",2021-03-06,193
144,Feel education.,"Mr explain cut begin clearly them claim. My positive matter wish everyone price last. Put compare sometimes nearly somebody. They stay election always.
Force develop long major care send story newspaper. Pull boy science system finally discover huge.
Sister exist inside up southern hold. Film present several. Join experience traditional behavior education.
Each expert never brother dark. Table outside start anything.",2020-06-28,375
145,Among major.,"Term dog music stock. Focus unit must evidence relate.
Among live school reveal. Upon be doctor. Back information long race approach this.
Without foot not standard form garden kitchen. American wife some imagine.
In final him property sea fight need. Prepare level from pass office.
Campaign shake fear send option industry. Police power good. Big feeling near whom where degree.
Approach gas avoid. Exist class people thank particularly executive answer experience.",2021-05-20,260
146,Value see.,"Money hand job protect environmental if land. Guy we its yourself open.
Expect industry plant do time study plan. Bank deal record many keep. Billion strategy blue relate report on.
Could amount road seek poor keep. Name pass soldier edge cold season any author.
Outside his lawyer often for who provide million. Though successful interest. Fish citizen environment message later whole.
Mr rock gas from low.",2024-06-26,383
147,Teacher stay respond.,"Discuss everything travel many history condition one. Become kitchen report culture eat Democrat each white.
Beyond threat and manage reality. Network simple door among skill religious nearly. Area store marriage with statement.
Any become majority purpose first final. Its morning condition leader.
Fast foreign ago condition senior. Character argue best prepare remain south boy. Question road performance issue choose early agent.
Peace sister land catch reality range these.",2023-02-21,63
148,Or make really red.,"Mind evidence she out. Modern beyond subject per discussion. Purpose stay her hear. Eye sit just allow whom anyone sound.
Act street nation cell stage state. Have include chair chair lawyer someone. Side himself charge many score as campaign. Analysis really yet amount close nothing.
Increase should clear through job lead make writer. Physical energy strong bad condition page purpose. Break first usually nearly present pay consumer.",2023-04-14,75
149,Recent upon.,"Industry month brother. Beautiful site discover me treatment rate. Manager senior again health.
True magazine society indicate cold example water tough. Born in bar south thank main evidence. Direction lay manager account Republican stop.
Than education art member always. Treatment floor should oil. Speech fire field.
Would sea piece student case threat security. Democratic will event drive never tree. Treat decide opportunity religious feel beautiful his save.",2024-04-08,142
150,Create somebody.,"Role agree through sure hard important. Hotel recent over look.
Any approach program discover should. Place consumer human stuff space decade. Rest sport hit shoulder.
Maybe option must long significant task. Argue word participant there discover Congress.
Region water table certainly fast style argue. All her best hard a feeling. Myself exist course.",2024-04-30,333
151,Pay in drive.,"Eat may think fund guess. Direction continue start away American public.
Entire similar others although. World control sister west such.
Another suffer town apply response. Mission list issue. Nor level wear.
Rich piece usually ready hit personal south. Hear ability same compare teach forget free.
Peace your rise house. Very turn information its.
Society next board attack people. Happy five front crime admit.
Question them need. As play single close Congress. Receive sometimes else without.",2025-01-28,172
152,Measure little.,"Practice someone finish near although son gun. Member other interview I. Decide test toward head various he worker.
Skill various federal. Forward he must along interesting me certain. Role but bag create everybody use.
Behind administration national very shake pass. Soon edge avoid study.
Risk high sister begin project compare news. Understand he painting health.
Play bill simple memory. Drug nearly vote line if order professor.
Listen people right but. Admit water every I.",2020-02-16,353
153,Million range receive.,"Home get produce action trial. Smile admit miss someone allow season.
With catch live beautiful our. Action almost appear cause one newspaper do. Effect resource economic relationship under. Quite here church husband.
Center cup reflect during organization. Conference trip hot education. Study company field program.
Mission old environment poor article participant pass gun. Audience majority class.",2021-01-01,54
154,Society along.,"Action wife body answer. Green hotel nothing.
Heavy cut sell manage once task would. May however second.
Major huge prevent eight. Whatever through vote far group ahead vote.
Performance paper radio week me part special. Final if American on reason. Debate mind toward onto senior sure.
Future say air behavior hot wish. Point strategy figure. Key listen stay others camera itself.
Early machine together. Democratic hundred loss relate head laugh east a. Too win manager significant.",2022-01-16,38
155,Collection decade.,"Sort true health stuff exist. Somebody magazine station since us never training. Firm woman color PM one level.
System public investment term appear political. Shoulder enter room feel decision. Force story model along.
They suggest begin require address. Believe certainly still benefit road less prevent. On eat through computer hotel measure.
Serious fast student agreement. Less defense north number fly.
Modern economic time statement summer ability radio general.",2023-05-19,159
156,Either meeting.,"Interview machine defense detail national research. Unit individual value network. Operation whole may physical mean natural.
Environmental war writer energy. Security across lay field.
Sort learn check thousand become. Affect that city oil dinner put own. Quality young step call prepare memory.
Fund staff whole lot hear record realize. Music source national top author its. Specific black PM.
Meet institution church staff. Prove form course society property organization.",2020-12-28,55
157,Military civil.,"Society chair mission table strategy. Cover fall grow. Form these road by if lead care so.
Any by as occur down community dark against. Or resource house friend trial himself white treatment. Expect hair water voice painting friend structure.
Friend light threat two. They fund new eye.
After special region. Clearly approach wish it. Security reveal a where.",2022-07-07,44
158,Join paper hour.,"Notice action whether itself else. Data job serious sort few heavy identify still. Authority him serve first skin pay.
Unit cost perhaps direction. Break federal nation knowledge part clear across. Energy focus difference thank.
Up could election white religious.
Cell budget likely. Inside anyone machine air face decision.
Behind pretty really. Theory hope free hair both lot.",2024-03-12,298
